{"baseline_matrix_sha256":"sha256:3ea6e925d98f4fd2c640479c985e5708d833266989d382b30f337d681da6156d","bundle_id":"host-delta-1-28c85a857d00","host_coordinate_profile_sha256":"sha256:28c85a857d00880b8790ace9c9fd0acd0ab843be811d1ca870bfa78192bc4f47","package_version":"0.1.19","schema_version":"godot-codex-surface-compatibility-bundle/1.0","sequence":1,"surfaces":[{"host_version":"26.803.41515","ide_host_version":null,"qualification":"supported","surface":"app","target":{"architecture":"arm64","os":"macos"}},{"host_version":"0.147.0-alpha.6.5","ide_host_version":null,"qualification":"supported","surface":"cli","target":{"architecture":"arm64","os":"macos"}},{"host_version":"26.803.41515","ide_host_version":"1.132.0","qualification":"supported","surface":"ide","target":{"architecture":"arm64","os":"macos"}}],"target":{"architecture":"arm64","os":"macos"}}